{
	"$schema": "../../info-schema.json",
	"name": "childFeature2",
	"label": "Child Feature 2",
	"description": "Lorem ipsum dolor sit amet, consectetur adipiscing elit. Sed do eiusmod tempor incididunt ut labore et dolore magna aliqua.",
	"dependencies": ["parentFeature", "helperLib", "helperLib2"]
}
